{"schema_version":"1.0","case_id":"case_00000000000000000000000000000001","purpose_ref":"opaque:00000000000000000000000000000002","retention_until":"2099-01-01T00:00:00Z","authorization":{"authorization_ref":"opaque:00000000000000000000000000000003","valid_from":"2020-01-01T00:00:00Z","expires_at":"2099-01-01T00:00:00Z","revoked":false},"collectors":[{"collector_id":"col_00000000000000000000000000000004","tool":"approved-export","version":"1","read_only":true}],"allowed_sources":[{"source_id":"src_00000000000000000000000000000005","source_type":"normalized_event_jsonl","collector_id":"col_00000000000000000000000000000004","source_provenance_ref":"opaque:00000000000000000000000000000006","authorization_ref":"opaque:00000000000000000000000000000003"}]}
